<?xml version="1.0" encoding="UTF-8"?>
<checklist xmlns="http://review.bechclipse.org" xmlns:xsi="http://www.w3.org/2001/XMLSchema-instance"
	xsi:schemaLocation="http://review.bechclipse.org Checklist.xsd ">
	<scope name="Class">
		<feature name="Inheritance">
			<checkpoint>
				<question>Is all the inheritance required by the design implemented	in the class?</question>
				<problem>Problem</problem>
				<solution>Make sure that something something</solution>
				<severity>HIGH</severity>
				<type>MISSING</type>
			</checkpoint>

			<checkpoint>
				<question>Is the inheritance appropriate?</question>
				<problem>Problem is that</problem>
				<solution>Make sure that something something</solution>
				<severity>HIGH</severity>
				<type>MISSING</type>
			</checkpoint>
		</feature>

		<feature name="Class constructor">
			<checkpoint>
				<question>Are all instance variables initialized with meaningful values?</question>
				<problem>Problem</problem>
				<solution>Make sure that something something</solution>
				<severity>HIGH</severity>
				<type>MISSING</type>
			</checkpoint>

		</feature>

	</scope>
</checklist>
